{
  "canonical_name": "spotify",
  "display_name": "Spotify",
  "default_category_template_key": "shopping_unterhaltung.tv_video_musik",
  "status": "active",
  "aliases": [
    { "type": "name_exact", "value": "spotify" },
    { "type": "name_fuzzy", "value": "spotify ab" },
    {
      "type": "regex",
      "field": "purpose",
      "value": "(einkauf bei|bestellung bei|shop|verkaeufer|händler)[a-zäöü: ]{0,20}spotify"
    }
  ]
}
