{
  "canonical_name": "telekom",
  "display_name": "Telekom",
  "default_category_template_key": "lebenshaltung.festnetz_internet",
  "status": "active",
  "aliases": [
    { "type": "name_exact", "value": "telekom" },
    { "type": "name_fuzzy", "value": "telekom deutschland" },
    { "type": "name_fuzzy", "value": "deutsche telekom" }
  ]
}
